"Уникнення ризиків, пов'язаних з алергенами",,,,,,
Question,Extra Info,A,B,C,D,Answer,Correct
"Який з наступних методів НЕ є методом перевірки наявності алергенів в приготовлених продуктах?",,"Читаємо рецепт","Запитуємо постачальника","Переглядаємо список інгредієнтів","Пробуємо невеликий зразок",D,"Правильна відповідь (D). Пробуємо невеликий зразок."
"Які з наступних дій можуть привести до перехресної контамінації алергенами?",,"Відкривати пакет з арахісом і далі займатися харчовими продуктами","Використовувати гарячу воду та мийний засіб для очищення столів","Впевнитися, щоб співробітники не носили прикрас","Впевнитися, що товари після доставки зберігаються правильно",A,"Правильна відповідь (А). Відкривати пакет з арахісом і далі займатися харчовими продуктами."
"Одним зі способів звести до мінімуму можливість перехресної контамінації при приготуванні їжі для алергіків є:",,"миття рук перед приготуванням їжі","одягнутий головний убір","утримання від роботи під час хвороби","використання різного обладнання для приготування страв з різних інгредієнтів",D,"Правильна відповідь (D). Всі перераховані вище методи важливі при приготуванні їжі, але використання різного обладнання безпосередньо стосується запобіганню контамінації їжі алергенами."
"Ви подали торт, у якому немає горіхів, окрім волоських горіхів зверху. Яку пораду ви б дали клієнту, якби він повідомив, що у нього алергія на горіхи?",,"Порадити не їсти торт","Зняти горіхи з верхньої частини торта","Сказати клієнту, щоб він залишив верхню частину","Сказати, що більшість людей з алергією на горіхи можуть їсти волоські горіхи",A,"Правильна відповідь (A). Порадити не їсти торт."
"Лише великі частини продуктів, що містять алергени, можуть потрапити в інші продукти та викликати алергічну реакцію. Це вірно?",,"Вірно","Невірно",,,B,"Правильна відповідь (B). Невірно. Невеликі частини продуктів, що містять алергени, можуть потрапити в інші продукти та викликати алергічну реакцію."