"Пищевые аллергены",,,,,,
Question,Extra Info,A,B,C,D,Answer,Correct
"Какие из этих продуктов могут вызвать острую аллергическую реакцию?",,"Арахисовые орешки","Моллюски","Молоко","Все вышеперечисленное",D,"Правильный ответ (D). Все вышеперечисленное."
"Какие из следующих продуктов могут содержать люпиновую муку?",,"Голландский соус","Омлет с сыром","Хлебобулочные изделия","Овощной суп",C,"Правильный ответ (С). Хлебобулочные изделия."
"Диоксид серы является основным аллергеном и консервантом. В чем из следующего он не будет содержаться?",,"Большие креветки","Молоко","Пиво","Сидр",B,"Правильный ответ (В). Молоко"
"На какой из следующих продуктов, содержащих аллергены, НЕ распространяются правила маркировки аллергенов в Великобритании?",,"Люпин","Ракообразные","Моллюски","Киви",D,"Правильный ответ (D). Киви"
"Предотвратить аллергическую реакцию можно более тщательным приготовлением проблемной пищи. Это верно?",,"Верно","Неверно",,,B,"Правильный ответ (B). Неверно"