"Thực phẩm ô nhiễm",,,,,,
Question,Extra Info,A,B,C,D,Answer,Correct
"Vi khuẩn cần gì để nhân lên?",,"Thức ăn, độ ấm, thời gian và độ ẩm","Vật nuôi, chất gây dị ứng và hư hỏng","Máu, nhiệt độ cao, nấm mốc và thời gian","Thực phẩm đông lạnh và thực phẩm có nguy cơ cao",A,"Chính xác (A). Thức ăn, độ ấm, thời gian và độ ẩm."
"Lây nhiễm chéo nghĩa là gì?",,"Đầu bếp tức giận","Việc di chuyển các chất độc hại vào thực phẩm, dùng tay chạm vào thực phẩm sống, chẳng hạn như thịt gà, sau đó chạm vào thực phẩm không được nấu chín, chẳng hạn như salad","Thức ăn chưa đạt nhiệt độ thích hợp để diệt khuẩn","Tất cả những điều trên",B,"Chính xác (B). Việc di chuyển các chất độc hại vào thực phẩm, dùng tay chạm vào thực phẩm sống, chẳng hạn như thịt gà, sau đó chạm vào thực phẩm không được nấu chín, chẳng hạn như salad."
"Nấm mốc là một mối nguy hóa học. Điều này đúng hay sai?",,"Đúng","Sai",,,B,"Chính xác. Sai."
"Tụ cầu vàng có thể được tìm thấy trên:",,"Trứng, gia cầm và các sản phẩm từ sữa","Gạo, mì ống và ngũ cốc","Da, vết cắt, nhọt bị nhiễm trùng và ở trong mũi","Tất cả những điều trên",C,"Chính xác (C). Da, vết cắt, nhọt bị nhiễm trùng và ở trong mũi."
"Mối nguy vật lý bao gồm?",,"Virus, nấm mốc, mầm bệnh và hư hỏng","Kim loại, đồ trang sức, nhựa, gỗ và thủy tinh","Ô nhiễm chéo, nhiệt độ không chính xác và tủ lạnh quá tải","Vi khuẩn Salmonella, vi khuẩn listeria, độc tố nấm mốc và thạch cao",B,"Chính xác (B). Kim loại, đồ trang sức, nhựa, gỗ và thủy tinh."