"Особиста гігієна",,,,,,
Question,Extra Info,A,B,C,D,Answer,Correct
"Чим працівники харчоблоку повинні закривати порізи та рани?",,"Марлею і бавовною","Еластичною пов'язкою","Непромокальною пов'язкою","Непромокальним блакитним пластиром",D,"Правильна (D). Щоб запобігти хімічному зараженню їжі шкідливими бактеріями та кров'ю, ці рани повинні бути повністю ізольовані непромокальним пластиром блакитного кольору."
"Миття рук дуже важливе для харчової безпеки. Коли потрібно мити руки?",,"Після відвідування туалету","Після викурювання сигарети","Після роботи з сирим м'ясом","Після виконання всього переліченого вище",D,"Правильна (D). Після виконання всього переліченого вище. Руки необхідно постійно тримати у чистоті за допомогою ретельного миття у гарячій воді з рідким милом. Ефективного висушування рук, що також важливе, можна досягти за допомогою одноразових рушників."
"Чому на території для приготування їжі заборонено носити ювелірні прикраси?",,"Тому що вони можуть потрапити в їжу, що готується","Тому що в них є бруд і бактерії, які будуть сприяти зараженню їжі"," Тому що вони можуть застрягти в обладнанні та стати причиною нещасного випадку","Все перелічене вище",D,"Правильна (D). працівникам харчоблоку не слід носити сережки, годинники, каблучки з камінням або брошки, оскільки в них є бруд і бактерії. А також тому, що камені або маленькі частинки металу можуть потрапити в їжу."
"Що вам потрібно зробити, якщо ви недавно були у відпустці і, перебуваючи у відпустці, страждали від блювоти, діареї і розладу шлунка?",,"Вийти на роботу, як зазвичай","Повідомити про це керівника до виходу на роботу","Прийняти ліки","Одягти рукавички під час приготування їжі",B,"Правильна (B). працівники харчоблоку, які страждають на діарею, блювоту або харчове захворювання, не повинні торкатися їжі. Вони повинні повідомити про свій стан керівника, який визначить, чи слід їм працювати з їжею, чи ні."
"Патогенні бактерії — бактерії, які шкідливі для людського організму — можна виявити на шкірі, у вухах, в носі та у роті, а також в інфікованих ранах. Як називається цей вид бактерій?",,"Сальмонела","Лістерія","Золотистий стафілокок","Кишкова паличка 0157",C,"Правильна (C). Патогенну бактерію золотистий стафілокок можна виявити на шкірі, вухах, в носі і в роті, а також в інфікованих ранах."