"Čo sú nebezpečné látky a čo zahŕňajú zdravotné riziká.",,,,,,
Question,Extra Info,A,B,C,D,Answer,Correct
"Čo je to látka (v zmisle tohto školenia)?",,"Ide o niečo prírodné alebo umelé a vyskytujúce sa v rôznych formách, ako sú kvapaliny, prach, plyny alebo pevné látky. Môžu byť nebezpečné","Ide o niečo prírodné alebo umelé čo môže byť nebezpečné",,,A,"Správna odpoveď (A). Ide o niečo prírodné alebo umelé a vyskytujúce sa v rôznych formách, ako sú kvapaliny, prach, plyny alebo pevné látky. Môžu byť nebezpečné."
"COSHH nariadenie takisto zahŕňa azbest, olovo alebo rádioaktívne látky. Je tento výrok pravda alebo klamnstvo?",,"Pravda","Klamstvo",,,B,"Klamstvo. Tieto sú pokryté inými nariadeniami."
"Účelom hodnotenia rizík COSHH je?",,"Určenie preventívnych opatrení a kontrol potrebných na ochranu vás a ostatných pred poškodením","Vyhnutie používania nebezpečných látok na pracovisku","Poskytnúť dôkazy pre kompenzácie liečebných nákladov, pokút a právnych krokov","Všetky z uvedených",A,"Správna odpoveď (A). Určenie preventívnych opatrení a kontrol potrebných na ochranu vás a ostatných pred poškodením."
"Čo je to nebezpečenstvo?",,"Pravdepodobnosť, že látky spôsobia škodu","Niečo, čo má potenciál spôsobiť škodu na niekoho zdraví, v tomto prípade látka","Obe z uvedených","Žiadne z uvedených",B,"Správna odpoveď (B). Niečo, čo má potenciál spôsobiť škodu na niekoho zdraví, v tomto prípade látka."
"Časť COSHH týkajúca sa ""látok"" zahŕňa akúkoľvek formu nebezpečného materiálu, ktorá pozostáva z ktorej z nasledujúcich zložiek?",,"Azbest","Olovo","Radioaktívne materiály ","Výrobky obsahujúce chemikálie",D,"Správna odpoveď (D). Výrobky obsahujúce chemikálie."